{
  "id": "the-opener",
  "title": "The Opener",
  "surah": "1",
  "nodes": [
    {
      "id": "d28ed58ec6066b8a",
      "x": -320,
      "y": -1172,
      "width": 440,
      "height": 175,
      "type": "ayah",
      "ayah": "1:1"
    },
    {
      "id": "abb24b15052d6891",
      "x": -320,
      "y": -910,
      "width": 440,
      "height": 152,
      "type": "ayah",
      "ayah": "1:2"
    },
    {
      "type": "text",
      "id": "b978866b317e22ac",
      "text": "- **Praising Allah is worshiping** \n- Praising is gratefulness\n- What is the Universe \n- All praise for the Owner of all worlds\n- Why Allah want us to be grateful ",
      "x": 250,
      "y": -910,
      "width": 480,
      "height": 154
    },
    {
      "id": "0064b30149860b4c",
      "x": -1070,
      "y": 360,
      "width": 400,
      "height": 186,
      "type": "ayah",
      "ayah": "1:4"
    },
    {
      "type": "text",
      "id": "ab12458c3c5c67ba",
      "text": "- **Everything has an end**\n- he own the judgement day, and he is the Judge \n",
      "x": -1070,
      "y": 760,
      "width": 400,
      "height": 160
    },
    {
      "id": "f2a3488070e37af2",
      "x": -1920,
      "y": -910,
      "width": 520,
      "height": 154,
      "type": "ayah",
      "ayah": "1:6"
    },
    {
      "id": "7cce77cb683c05ea",
      "x": -1920,
      "y": -660,
      "width": 520,
      "height": 160,
      "type": "ayah",
      "ayah": "1:5"
    },
    {
      "id": "a1cabbc809cf9ebd",
      "x": -320,
      "y": -654,
      "width": 440,
      "height": 174,
      "type": "ayah",
      "ayah": "1:3"
    },
    {
      "type": "text",
      "id": "9c2f7a125cebf5f9",
      "text": "- **Compassion for all beings**\n- Rehman and Raheem both driven by common word Reham meaning tenderness, love, and mercy\n- Together, they encapsulate the totality of divine compassion",
      "x": 250,
      "y": -637,
      "width": 480,
      "height": 140
    },
    {
      "type": "text",
      "id": "10be4cc983de9ba8",
      "text": "**The Opener** \nfoundational prayer and summary of the core message of Islam.\n1. starting / intention\n2. surrender \n3. mercy & compassion\n4. the End\n5. worship & help\n6. the Straight path\n7. lost & ignorant ",
      "x": -1040,
      "y": -80,
      "width": 340,
      "height": 285,
      "color": "#44ff00"
    },
    {
      "id": "3fbc6c994d2169ca",
      "x": -3160,
      "y": -907,
      "width": 400,
      "height": 146,
      "type": "path",
      "path": "straight"
    },
    {
      "id": "bca9c261713b0148",
      "x": -3160,
      "y": -1159,
      "width": 400,
      "height": 149,
      "type": "path",
      "path": "deviated"
    },
    {
      "id": "6a98fb1106687a60",
      "x": -1920,
      "y": -1172,
      "width": 520,
      "height": 175,
      "type": "ayah",
      "ayah": "1:7"
    },
    {
      "type": "text",
      "id": "03c616ae4b8a2d72",
      "text": "- **The Opening of opening** \n- The only Surah counts Bismillah as its Ayah\n- What is the link between intention and this ayah?\n- Intention first, action second\n- Al Rehman & Al Rahim\n- Try not to do things you cannot start with Bismillah",
      "x": 250,
      "y": -1172,
      "width": 480,
      "height": 175
    },
    {
      "id": "5f763594ee6036b3",
      "x": -1243,
      "y": -1592,
      "width": 747,
      "height": 420,
      "type": "image",
      "image": "surah_001.png"
    },
    {
      "type": "text",
      "id": "36fd047e33585f7d",
      "text": "",
      "x": -2560,
      "y": -1172,
      "width": 500,
      "height": 175
    },
    {
      "type": "text",
      "id": "cff4b6b258484155",
      "text": "- **Nobody other than Allah worthy to be Worship or ask for help** \n- Nobody other than Allah powerful enough to be afraid off\n- A strong believer only rely on Allah for everything",
      "x": -2560,
      "y": -660,
      "width": 500,
      "height": 160
    },
    {
      "type": "text",
      "id": "bc0fa6394453cf65",
      "text": "- **Seeking guidance to the Straight Path**\n- You need him to be on the straight path\n- clear, balanced life, worshiping God, divine guidance, moral righteousness.\n- Seeking and supporting truth ",
      "x": -2560,
      "y": -910,
      "width": 500,
      "height": 154
    }
  ],
  "edges": [
    {
      "id": "9a85df1b275952b8",
      "fromNode": "10be4cc983de9ba8",
      "fromSide": "right",
      "toNode": "d28ed58ec6066b8a",
      "toSide": "left"
    },
    {
      "id": "0c5ee184eb093e13",
      "fromNode": "d28ed58ec6066b8a",
      "fromSide": "right",
      "toNode": "03c616ae4b8a2d72",
      "toSide": "left"
    },
    {
      "id": "cf0629f392de07da",
      "fromNode": "10be4cc983de9ba8",
      "fromSide": "right",
      "toNode": "abb24b15052d6891",
      "toSide": "left"
    },
    {
      "id": "a913524e4ddd9cb5",
      "fromNode": "abb24b15052d6891",
      "fromSide": "right",
      "toNode": "b978866b317e22ac",
      "toSide": "left"
    },
    {
      "id": "fa064ccf36ec3206",
      "fromNode": "10be4cc983de9ba8",
      "fromSide": "right",
      "toNode": "a1cabbc809cf9ebd",
      "toSide": "left"
    },
    {
      "id": "660415255ca1f840",
      "fromNode": "a1cabbc809cf9ebd",
      "fromSide": "right",
      "toNode": "9c2f7a125cebf5f9",
      "toSide": "left"
    },
    {
      "id": "4db0bef4f814f70e",
      "fromNode": "10be4cc983de9ba8",
      "fromSide": "bottom",
      "toNode": "0064b30149860b4c",
      "toSide": "top"
    },
    {
      "id": "74e67dfb73ce81cd",
      "fromNode": "10be4cc983de9ba8",
      "fromSide": "left",
      "toNode": "6a98fb1106687a60",
      "toSide": "right"
    },
    {
      "id": "b477cc3509184d88",
      "fromNode": "10be4cc983de9ba8",
      "fromSide": "left",
      "toNode": "f2a3488070e37af2",
      "toSide": "right"
    },
    {
      "id": "8b5d703c0e73534a",
      "fromNode": "10be4cc983de9ba8",
      "fromSide": "left",
      "toNode": "7cce77cb683c05ea",
      "toSide": "right"
    },
    {
      "id": "953d42e798aa9441",
      "fromNode": "0064b30149860b4c",
      "fromSide": "bottom",
      "toNode": "ab12458c3c5c67ba",
      "toSide": "top"
    },
    {
      "id": "fc48eaeec6c59fb0",
      "fromNode": "7cce77cb683c05ea",
      "fromSide": "left",
      "toNode": "cff4b6b258484155",
      "toSide": "right"
    },
    {
      "id": "656ccd9a66cd9973",
      "fromNode": "f2a3488070e37af2",
      "fromSide": "left",
      "toNode": "bc0fa6394453cf65",
      "toSide": "right"
    },
    {
      "id": "ca25dbe2685c0f43",
      "fromNode": "6a98fb1106687a60",
      "fromSide": "left",
      "toNode": "36fd047e33585f7d",
      "toSide": "right"
    },
    {
      "id": "5a2ba4f0ac3c8b54",
      "fromNode": "36fd047e33585f7d",
      "fromSide": "left",
      "toNode": "bca9c261713b0148",
      "toSide": "right"
    },
    {
      "id": "76687bea94b51e3c",
      "fromNode": "bc0fa6394453cf65",
      "fromSide": "left",
      "toNode": "3fbc6c994d2169ca",
      "toSide": "right"
    }
  ]
}
